{
  "seq": 3,
  "ts": "2026-10-18T02:14:09Z",
  "proposal_id": "P-0003",
  "approved_by": "secops",
  "verification_sha256": "0000000000000000000000000000000000000000000000000000000000000000",
  "cbom_sha256": "1111111111111111111111111111111111111111111111111111111111111111",
  "prev_hash": "2222222222222222222222222222222222222222222222222222222222222222",
  "alg": "ML-DSA-65",
  "sig_b64": "c2lnbmF0dXJl"
}
